<?xml version="1.0" encoding="utf-8" ?>
<!DOCTYPE students SYSTEM "student.dtd">
<students>
    <stu number="s001">
        <name></name>
        <age></age>
        <sex></sex>
    </stu>

    <stu number="s002">
        <name></name>
        <age></age>
        <sex></sex>
    </stu>

</students>